{
  "$schema": "./schema/installed-base-domain.contract.schema.json",
  "name": "installed-base-domain",
  "version": "0.7.0-alpha.0",
  "status": "target",
  "source": "guidelines/source/domain-models/installed-base.md",
  "screenContext": "installed-base-intelligence",
  "assetHierarchy": [
    "Building",
    "Electrical Area",
    "Room",
    "Asset"
  ],
  "assetFamilies": [
    "MV Switchgear",
    "LV Switchgear",
    "UPS",
    "Cooling",
    "Transformer",
    "Busway",
    "PDU",
    "Battery System"
  ],
  "assetStates": [
    "connected-oem",
    "connected-oem-with-alert",
    "connected-oem-with-connectivity-issue",
    "non-connected-oem",
    "non-connected-oem-with-service-history",
    "third-party"
  ],
  "connectivityValues": [
    "Connected",
    "Not connected",
    "Unknown"
  ],
  "filterConnectivityValues": [
    "Connected",
    "Non-connected"
  ],
  "healthValues": [
    "Critical",
    "Poor",
    "Fair",
    "Good",
    "Excellent",
    "Unknown"
  ],
  "coverageValues": [
    "Premium Service Plan Advanced",
    "Premium Service Plan Essential",
    "Advanced Service Plan",
    "No Coverage"
  ],
  "dppValues": [
    "DPP Enabled",
    "No DPP"
  ],
  "filterDppValues": [
    "With Digital Product Passport",
    "Without Digital Product Passport"
  ],
  "statusLabels": [
    "Live telemetry",
    "Active alert",
    "Connectivity issue",
    "Last service visit",
    "No record"
  ],
  "filterStatusValues": [
    "Live Telemetry",
    "Active Alert",
    "Last Service Visit",
    "No Record"
  ],
  "statusIcons": {
    "Live telemetry": "✓",
    "Active alert": "⚠",
    "Connectivity issue": "⚠",
    "Last service visit": "◷",
    "No record": "—"
  },
  "ageValues": [
    "< 5 years",
    "5–9 years",
    "10+ years"
  ],
  "thirdPartyAssetRules": {
    "connectivity": "Unknown",
    "coverage": "No Coverage",
    "health": "Unknown",
    "status": "No record",
    "exceptionsAllowed": false
  },
  "attentionRequiredRule": {
    "groupLabel": "Attention required",
    "triggers": [
      "Active alert",
      "Connectivity issue"
    ],
    "placement": "top-of-installed-base-list"
  },
  "factInterpretationSeparation": {
    "Health": [
      "facts",
      "measurements",
      "observations",
      "current condition",
      "telemetry",
      "alert facts",
      "freshness",
      "source"
    ],
    "Intelligence": [
      "diagnosis",
      "interpretation",
      "benchmarking",
      "recommendation",
      "expected outcome",
      "proof readiness",
      "source strength",
      "validation",
      "action plan",
      "owner",
      "due date",
      "priority"
    ],
    "duplicationAllowed": false
  },
  "progressiveDecisionDisclosure": {
    "principle": "Generated decision screens must reveal decision-critical information first, then expose evidence and explanation progressively.",
    "levels": [
      "signal",
      "decision",
      "evidence"
    ],
    "defaultDisclosure": "signal-first"
  }
}
